编号,场景,文案,图片url,音频url,视频url,用户id
50369,5502,不知道那会儿我还追不追星看不看演出，不管我还在不在场，都祝福你有更大的舞台，被更多人喜爱 最重要是开心~自在~,,,,玛卡巴卡混账到老
50370,5502,40岁的你一定还和现在一样可爱有活力，希望这四年你出了很多新歌尝试你喜欢的一切风格得很多奖！23岁的我有没有做上想要做的旅行博主呢有没有继续玩乐队呢有没有画出艺术呢希望23岁的自己离你更进一步,,,,ike
50371,5502,原来这个时候我都已经成年3年了，遇上你爱上你都8年了，好快啊。有没有爱你爱得更坚定一些，有没有好好听你唱歌，我的路还很长，我想多一大截陪在你身边,,,,阿七
50372,5502,希望恋恋和我都更坚定,,,,加绒
50373,5502,不惑之年！永远乐观向上！,,,,大尻
50374,5502,这四年里过得怎么样    有没有照顾好自己呀,,,,摇一摇
50375,5502,2030年的恋恋姐，你现在怎么样呀创作还开心吗希望你开心，手里多了很多自己满意的作品，在爱与被爱的世界里活的尽兴。希望2030年的我没有中年人的常见烦恼，身体健康、生意兴隆、生活富足，家人安康、爱人不作妖。,,,,Huan
50376,5502,很高兴看到你如此健康,,,,马天天天
50377,5502,"2026年，我说我永远愛妳。
此刻如果妳愿意呼唤我的名字----
“是我，我在。”",,,,陈xr
50378,5502,活到现在的我们都很棒，如果进展顺利，我们应该已经在工作里见过了，如果不顺利，那希望你依然愿意演舞台给我们看,,,,二哈
50379,5502,如果那个时候真的有女儿了 可以让我做干妈不 哈哈哈,,,,小蝴蝶Sylvia
50380,5502,希望没有辜负自己，成为成好的人，有更精彩的生活。以及依然在场。在现场，也依然在爱着你。,,,,就酱儿
50381,5502,姐姐一定还在写好听的作品，开了好多巡演。我应该工作两年了吧，可以自己赚钱去看演出了，至少要看三次巡演！两次音乐节！,,,,虾条
50382,5502,五年后的话，希望到时候我在体育馆内场前排看姐姐的演唱会，反正我肯定得在内场，我肯定也考上了心仪的大学成为了一名人民教师哈哈哈,,,,理论摄影部
50383,5502,2030年我抢到刘恋巡演体育馆内场一排了吗,,,,江鸟
50384,5502,那时候姐姐应该上了更大的舞台，四专应该也出生了吧(bushi)那时候的我时间应该也更自由了，和姐多多见面吧！总而言之每年的生日都要陪姐过！,,,,薯条一盒
50385,5502,全世界的工作和财富都吻向我们吧！,,,,和桃桃争宠
50386,5502,快乐的过下去吧。我们都是,,,,Kkxxx
50387,5502,看来四年也不慢啊，一转眼都爱你快十年了，你应该遵守和我的约定一直在舞台上闪闪发光吧。你一直唱，我一直陪，说好的我们要唱到养老院。爱你真的是一件很幸福的事,,,,奕只屁屁桃
50388,5502,四年后我们都要过精彩的人生，顺顺利利，如果可以，我一直都会在,,,,到现在你还在场
50389,5502,我们各自的理想还长存吗,,,,女人不要生气
50390,5502,噢我也来到了人生才刚刚开始的30s阶段，希望你我在此刻都能自洽和拥有向前的勇气，还有就是40岁的刘恋未来也多多见面吧,,,,hia
50391,5502,现在才16，40可能对我来说有点太遥远了，但还是希望40岁的我们还有感受美好与爱的能力，还能保持对这个世界的热情。,,,,爱羽球的小耗子
50392,5502,"高考完了诶 大四了该找工作了，希望自己能去北京吧，不切实际但是希望有一天能得到和刘女士面对面畅聊的机会，妳是我女性主义的启蒙者，感觉自己能长这么根正苗红有遍听妳访谈播客的功劳，祝我们永远年轻不听话
  大有可为，祝妳祝我",,,,不困
50393,5502,四年，那时候我已经找到心仪的工作或者博士毕业了吧。希望我依然在场。,,,,闻起来也不像个受
50394,5502,40岁正是闯的年纪~生命不息创作不止，恋恋一定已经拥有更多好歌好作品了，我们都健健康康的，你还在台上唱，我还在台下听。,,,,KIYO
50395,5502,应该已经在公司里面实习过一段时间了吧，或许已经转正了,,,,范德贝克
50396,5502,刘恋是不是已经发到第五张专辑了！大学你一定看了好多好多演出。一定也选好自己喜欢的职业了吧,,,,鱼信国王13
50397,5502,不知道40岁的刘恋有更精彩么，35岁的我有更自由么,,,,只喜欢刘恋
50398,5502,40岁的刘恋，难以想象多么有魅力呀！30岁的我，应该不那么焦虑了吧,,,,林詩梅
50399,5502,恋恋有发我喜欢的新专辑吗有可以支撑我生活的新歌吗未来我还有精力追星吗，没有被工作打败吧,,,,吃悬浮
50400,5502,我们是越来越好了吧有变的更自由、鲜活、热烈吗无论怎样，我想我还是一直在爱你,,,,掉色蓝水母
50401,5502,40岁的你一定越来越好了吧 爱你的人越来越多 那时的我可能还是个一事无成 害怕且不愿改变的人 但我一定还会爱你,,,,ppeuppeu(噗噗）
50402,5502,我们一定会越来越好越来越爆的！我现在可以跟自己和解了嘛，我有见恋很多次舞台嘛！恋，想见你。,,,,不想吃饭le
50403,5502,天哦40岁的刘恋你好，我是小你一轮的妈粉，希望我能顺利毕业找个好工作，你这个时候已经能在体育馆开演唱会了吧，当时觉得30岁是大限将临，那40岁的年纪如何看待呢，不敢想4年后我也即将三十，还能如现在这般潇洒洒脱吗，答应过这几年一定要多多见刘恋嘛，我真的等着一起相伴到老，到时候真的就是名副其实的老粉了   ,,,,躺躺（Tttt.）
50404,5502,四年以后吗，希望我们已经见了好多面，都在变成更好的自己,,,,WiSH.
50405,5502,,,,,止望海
50406,5502,4年以后吗其实很难想象时间在你的身上流逝，那个时候我应该会比较从容的来见你了吧，希望那个时候你还在，我也在。,,,,mymy
50407,5502,40岁的刘恋应该依旧是作为我人生的优秀女性范本存在着，那时的你一定更加爱自己了，我也会更加爱你。期盼咱俩的事业都能更上一层楼！,,,,h一线
50408,5502,40岁的刘恋你好 今年准备出几首新歌 开几场巡演 有福建场吗 要一直多多见面哦！,,,,子千
50409,5502,想要的都得到,,,,蜗牛壳
50410,5502,,,,,迷恋不营业
50411,5502,出了几首惊天动地的歌，我们依然在一场场巡演中见面,,,,baymax6-
50412,5502,恋恋演出门票是不是越来越难抢了因为毕业实习，总忍不住担心以后工作身不由己，没办法实现多多见面。希望自己力排万难，也希望还能顺利抢到演出门票，更希望在前排！愿我们都要幸福！,,,,凌云木LMX
50413,5502,各自努力过喜欢的生活，不管世界变成什么样爱的人还在场。爱着却不靠近，想起刘恋心底仍然能获得平静与勇气,,,,bourbon
50414,5502,那时我也21岁了 未来的我们有没有成为自己想成为的人呢～好像见到40岁的刘恋 看看那时的她多有魅力,,,,77
50415,5502,姐姐，四年实在是不过是白驹过隙，自从认识你，我再也不觉得老去是什么可怕的事情，如今的你和我一定比四年前拥有更多美好的人生经历。未来我们也一定会变得更好！,,,,KkkAwAiiii_卡卡
50416,5502,40岁的刘恋不知道已经出到第几张专辑了，四十岁的我应该有你一半厉害了,,,,成ke星xingxing 
50417,5502,那时的刘恋一定有更多特别特别棒的作品 能更加随心热烈 希望我也能成为更厉害的大人,,,,星荷Lotus 
50418,5502,40岁的刘恋肯定出了好多好多歌了吧，应该有更多人爱你了吧，希望我们都能活成自己想要的样子！,,,,缺牙巴贝壳
50419,5502,姐成为搞艺术的富婆，我还能奔赴富婆的每一场演出，哈哈,,,,苏格拉没有底
50420,5502,不知道那时我是否还像现在一样有充足的精力去喜欢着恋，但那时的刘恋一定还是依旧热爱音乐，依旧有活力去探索这个世界，挑战新的领域，也许会成为灵活小舞者吧,,,,优雅气质小熊猫
50421,5502,好像也不算很远了，40岁的刘女士，我希望到时我依然在场，听你的每一首歌，说不定那时候的你又获得金曲奖，希望那时的我能有更强的经济能力，争取巡演全勤吧，跟着恋恋去冒险！,,,,小太阳阳阳昂
50422,5502,40岁的刘女士会在哪里，我又会在哪里呢那个时候我还会像现在这样爱着你吗其实不太敢轻易说永远，但起码在当下和此刻我只有爱刘恋到永恒这一个念头。希望那个时候我已经有足够的经济能力追着恋恋姐到处跑,,,,潮汐
50423,5502,抢刘恋女士的演唱会门票！鸟巢连开三天   ,,,,金盆洗手版的憨
50424,5502,希望我们都越来越好，愿我们的自我永远在场。,,,,HAN
50425,5502,希望都能成为我们想要的样子,,,,吃饭喝粥吧
50426,5502,祝我们一切都好！希望你红红火火，而我依然在场。,,,,那就吃颗糖好了_
50427,5502,,,,,Hasdeztwazi
50428,5502,希望我们都完成了这个阶段里想做的事情,,,,嘎嘣脆小靖
50429,5502,过好各自的生活，如约相见,,,,张文Rose
50430,5502,祝我们都能过上自己最想要的生活,,,,咂酱面_
50431,5502,希望到那时一切都会变好。,,,,小能
50432,5502,我们都成为了内心温柔，灵魂自由的人，都过上了自己理想中的生活。,,,,啦啦啦波小吉 
50433,5502,希望有线下生日会！大办一场！大家一起变有钱！,,,,梦想是成为闲鱼王
50434,5502,"刘恋会成为很厉害的歌手 有自己的思想 有自己的作品 做了很多想尝试的事
而我是一个起码不会误人子弟的老师...
我俩都会越来越好 特别特别好",,,,#85
50435,5502,2030啊，刘恋有没有赚够钱啊，当一个自由自在的歌手，做什么都可以，回去继续做广告也很好。27岁的我，还在继续读书吗还是成为Officelady了有谈到恋爱吗！,,,,麻瓜小王
50436,5502,希望我们都能做自己想做的 成为自己喜欢的模样 那时候的我也会一直在场一直听刘恋唱歌 多多见面！,,,,祈求白昼
50437,5502,40岁的你和27岁的我    希望那时的我们面对逆境可以更加从容  面对夸奖可以坦然接受  愿你已经成为了搞艺术的超级大富婆  也愿我能在自己的领域有所成就,,,,老虎欣
50438,5502,我们都越来越好，一起发财，一起听姐唱歌。,,,,试图不熬夜
50439,5502,今年的巡演准备的如何了         ,,,,爪巴
50440,5502,希望恋恋依然在过自己想要的人生！而我...巡演有票求求求求了,,,,蕊蕊要吃冰淇淋
50441,5502,30岁的我依旧在场，对着40岁的刘女士说“你看根本就没什么7年之痒，我来对你这第八次生日快乐了”,,,,浣熊没有脑袋
50442,5502,你现在还在认真做自己吗还开心吗,,,,明明乖乖
50443,5502,还好有你在场,,,,嘟嘟
50444,5502,你的理想还长存吗,,,,风沐凡尘
50445,5502,你有变得更厉害吗,,,,华
50446,5502,祝我们有强壮的身体和轻盈的灵魂,,,,梨糖
50447,5502,那时候我们都会成为自己想成为的人了，对吧,,,,为堂
50448,5502,愿我们身体健康！心想事成！常相见！,,,,果冻
50449,5502,一切皆如所愿,,,,恋恋许愿池
50450,5502,"愿40岁的时候 我们仍然陪伴着彼此 
愿你仍然尽兴善良 拿着麦克风 背着吉他
而我也能始终在场 将我的望远镜 对准深空那颗最闪亮的星星
我们会一起成为 更好的人的",,,,阿赤
50451,5502,就40了吗，时间好快啊，还好我还在场，还好你还是我的唯一。,,,,可乐加冰
50452,5502,好幸福我们到今天依然相识，更幸福的是我依然热情高涨的想见你，见到你还是那句话“恋，好久不见，你想我了没”，希望你能记得,,,,20190330一
50453,5502,40岁的恋恋已经像期望中那样少了很多焦虑，却依然充满了荷尔蒙吗是不是又开辟了什么意想不到的平行人生呢希望命运眷顾这个努力的小恋，灵感之神到40岁仍然是家里的座上宾，已经有了许多名垂青史的作品。那时候的我34岁，不知道是不是已经不再漂泊，找到一个自己心中能安定的地方了呢希望我们依然陪伴着彼此，健康、快乐，也能常常相见。,,,,吃着菌儿
50454,5502,终于开启独居生活，清晨和傍晚一边放着恋恋的黑胶一边打哈欠、好幸福、我们都会更幸福的 :),,,,絮
50455,5502,我比你先去40看看风景了，到时候你的管她什么歌词里对40的“期许”应该是我先达成了,,,,星野
50456,5502,姐40我31，正是大好年华，希望我们都有钱，有自由，没烦恼,,,,美味蟹堡王
